{
 "schema_version": "1.0",
 "kind": "sit_eval.scores",
 "generated_at": "2026-10-02T14:11:40Z",
 "inputs": {
  "report_path": "docs/live_runs/live_cc_opus_payments_v1/report.json",
  "report_sha256": "d1637d57e45a50c49c5832b5d5e444a49c7226edae90eea5df20fb186d4de569",
  "review_id": "REV-live_cc_opus_payments_v1",
  "run_id": "live_cc_opus_payments_v1",
  "review_mode": "full",
  "condition": null,
  "split": null,
  "key_path": "eval/synthetic/payments_orchestration/answer_key.canonical.json",
  "key_sha256": "e9169d9b99532dace9123bc3520d2243cb1c932e7b73038434ab2c70fc2b3466",
  "item_id": "synthetic-payments-orchestration-001",
  "key_split": "S-dev",
  "scored_run_ready": false,
  "doc_version": "v1",
  "doc_source": "pdf:eval/synthetic/payments_orchestration/design_v1.pdf (sit_review_agent.ingest.ingest, pdfplumber)",
  "doc_sha256_text": "ad0bb891f073f14325b6ba716d58070d6b074ebaef9a9c64432138b89b64ec3c",
  "doc_sha256_text_matches_review": true
 },
 "prereg": {
  "path": "/home/user/SIT/eval/prereg.yaml",
  "exists": true,
  "frozen": false,
  "sha256": "63cd8a6fcb52dfea54874defffb06a7cff00405007272493af0631c11b464c40",
  "lock_sha256": null,
  "matcher_prompt_sha256": null,
  "ok_to_score": true,
  "label": "pilot_unfrozen",
  "message": "eval/prereg.yaml is not frozen (frozen: false): these scores are UNFROZEN PILOT scores, exploratory only, and carry no confirmatory claim"
 },
 "prompts": {
  "bundle_sha256": "d9e14df564478b453b54e47560ef72a5d98a457a262f7bc31dd7809905a996dd",
  "lock_ok": true,
  "problems": []
 },
 "judge": {
  "judge_kind": "claude_code",
  "model": "claude-opus-5-5",
  "effort": "high",
  "max_tokens": 16000,
  "samples": 3,
  "seed": 20261002,
  "granularity": "per_flaw_batch",
  "shortlist_k": 3,
  "severity_epsilon": 0.01,
  "concurrency": 4,
  "max_cost_usd": 12.0,
  "grounding_judges": false,
  "recommendation_judge": false,
  "theta_q": 0.9,
  "condition": null,
  "embedding_prefilter": false,
  "adaptive_samples": true,
  "blinding": "prompts carry no run id, model, condition, provenance or confidence; findings shuffled per listwise call with the recorded seed"
 },
 "status": "pilot_unfrozen",
 "warnings": [
  "eval/prereg.yaml is not frozen (frozen: false): these scores are UNFROZEN PILOT scores, exploratory only, and carry no confirmatory claim",
  "answer key has scored_run_ready = false (pending: author_model, generation_date, canary_guid, core_insight, anchor_quote, expected_disposition, approved_decisions, key_second_review, external_fact_verification, sound_overlap_annotations, v2_changed_sections, author_type); core_insight is filled from the description and credit items, so matcher scores are provisional",
  "call granularity per_flaw_batch is a DEVIATION from prereg matcher.pairwise_scoring (one call per pair); it needs the owner's approval before any scored run",
  "adaptive third sample: the third pairwise sample is asked only when the first two disagree or one failed (the median of 3 is then unchanged); this reading of prereg '3 samples, median' needs the owner's approval before any scored run",
  "grounding judges switched off: G3 and citation support metrics are null"
 ],
 "metrics": {
  "recall": {
   "value": 0.7142857142857143,
   "reason": null,
   "status": "primary",
   "tp": 10,
   "g": 14
  },
  "precision_strict": {
   "value": 0.5,
   "reason": null,
   "status": "secondary",
   "tp": 10,
   "n": 20
  },
  "precision_adjudicated": {
   "value": 0.95,
   "reason": null,
   "status": "key_secondary",
   "tp": 10,
   "v": 9,
   "n": 20
  },
  "precision_adjudicated_partial_credit": {
   "value": 0.95,
   "reason": null,
   "status": "exploratory",
   "tp": 10,
   "v_or_partial": 9,
   "n": 20,
   "partial_key_findings": [
    "FND-004",
    "FND-012",
    "FND-016",
    "FND-017"
   ]
  },
  "f1_strict": {
   "value": 0.588235294117647,
   "reason": null,
   "status": "secondary"
  },
  "f1_adjudicated": {
   "value": 0.8154506437768242,
   "reason": null,
   "status": "secondary"
  },
  "duplication_rate": {
   "value": 0.0,
   "reason": null,
   "status": "secondary"
  },
  "non_specific_rate": {
   "value": 0.05,
   "reason": null,
   "status": "secondary"
  },
  "adjudication_counts": {
   "value": {
    "NON_SPECIFIC": 1,
    "VALID_UNPLANTED": 9
   },
   "reason": null,
   "status": "secondary",
   "bases": {
    "llm": 10
   }
  },
  "lenient_recall": {
   "value": 1.0,
   "reason": null,
   "status": "secondary",
   "tp": 14,
   "g": 14
  },
  "lenient_precision_strict": {
   "value": 0.7,
   "reason": null,
   "status": "secondary",
   "tp": 14,
   "n": 20
  },
  "lenient_precision_adjudicated": {
   "value": 0.95,
   "reason": null,
   "status": "secondary",
   "tp": 14,
   "v": 5,
   "n": 20
  },
  "lenient_f1_strict": {
   "value": 0.8235294117647058,
   "reason": null,
   "status": "secondary"
  },
  "lenient_f1_adjudicated": {
   "value": 0.9743589743589743,
   "reason": null,
   "status": "secondary"
  },
  "lenient_duplication_rate": {
   "value": 0.0,
   "reason": null,
   "status": "secondary"
  },
  "lenient_non_specific_rate": {
   "value": 0.05,
   "reason": null,
   "status": "secondary"
  },
  "lenient_adjudication_counts": {
   "value": {
    "NON_SPECIFIC": 1,
    "VALID_UNPLANTED": 5
   },
   "reason": null,
   "status": "secondary",
   "bases": {
    "llm": 6
   }
  },
  "pooled_recall": {
   "value": null,
   "reason": "no pooled supplementary key G+ exists yet (built from human-confirmed VALID_UNPLANTED after an evaluation round, metrics.md §2.3 step 5)",
   "status": "secondary"
  },
  "per_category": {
   "value": {
    "acceptance_criterion_cannot_validate": {
     "recall": 1.0,
     "precision": 1.0,
     "f1": 1.0,
     "typed_recall": 1.0,
     "gold": 1,
     "matched": 1,
     "agent_findings": 1
    },
    "ambiguous_requirement": {
     "recall": 0.0,
     "precision": 1.0,
     "f1": 0.0,
     "typed_recall": 0.0,
     "gold": 1,
     "matched": 0,
     "agent_findings": 1
    },
    "decision_depends_on_pending_item": {
     "recall": 1.0,
     "precision": 1.0,
     "f1": 1.0,
     "typed_recall": 1.0,
     "gold": 1,
     "matched": 1,
     "agent_findings": 1
    },
    "internal_contradiction": {
     "recall": 1.0,
     "precision": 1.0,
     "f1": 1.0,
     "typed_recall": 1.0,
     "gold": 3,
     "matched": 3,
     "agent_findings": 5
    },
    "missing_or_unverifiable_requirement": {
     "recall": 0.0,
     "precision": 0.75,
     "f1": 0.0,
     "typed_recall": 0.0,
     "gold": 2,
     "matched": 0,
     "agent_findings": 4
    },
    "scalability_or_failure_mode": {
     "recall": 1.0,
     "precision": 1.0,
     "f1": 1.0,
     "typed_recall": 1.0,
     "gold": 2,
     "matched": 2,
     "agent_findings": 3
    },
    "security_privacy_gap": {
     "recall": 1.0,
     "precision": 1.0,
     "f1": 1.0,
     "typed_recall": 1.0,
     "gold": 2,
     "matched": 2,
     "agent_findings": 3
    },
    "unsupported_or_incorrect_claim": {
     "recall": 0.5,
     "precision": 1.0,
     "f1": 0.6666666666666666,
     "typed_recall": 0.0,
     "gold": 2,
     "matched": 1,
     "agent_findings": 2
    }
   },
   "reason": null,
   "status": "exploratory",
   "note": "recall by gold category, precision by the agent's category; macro-over-docs is computed by `sit-eval aggregate`"
  },
  "category_label_accuracy": {
   "value": 0.9,
   "reason": null,
   "status": "exploratory",
   "confusion": [
    {
     "gold": "acceptance_criterion_cannot_validate",
     "agent": "acceptance_criterion_cannot_validate",
     "n": 1
    },
    {
     "gold": "decision_depends_on_pending_item",
     "agent": "decision_depends_on_pending_item",
     "n": 1
    },
    {
     "gold": "internal_contradiction",
     "agent": "internal_contradiction",
     "n": 3
    },
    {
     "gold": "scalability_or_failure_mode",
     "agent": "scalability_or_failure_mode",
     "n": 2
    },
    {
     "gold": "security_privacy_gap",
     "agent": "security_privacy_gap",
     "n": 2
    },
    {
     "gold": "unsupported_or_incorrect_claim",
     "agent": "internal_contradiction",
     "n": 1
    }
   ]
  },
  "severity_weighted_recall": {
   "value": 0.7166666666666667,
   "reason": null,
   "status": "key_secondary",
   "variants": {
    "weights_primary__mapping_primary": 0.7166666666666667,
    "weights_primary__mapping_sensitivity": 0.71875,
    "weights_sensitivity__mapping_primary": 0.7105263157894737,
    "weights_sensitivity__mapping_sensitivity": 0.7142857142857143
   }
  },
  "critical_recall": {
   "value": 0.75,
   "reason": null,
   "status": "secondary"
  },
  "severity_agreement_qwk": {
   "value": 0.3820224719101125,
   "reason": null,
   "status": "secondary",
   "n_pairs": 10,
   "exact_agreement": 0.2,
   "under_rated": 4,
   "over_rated": 4,
   "confusion": [
    {
     "gold": "critical",
     "agent": "high",
     "n": 3
    },
    {
     "gold": "high",
     "agent": "critical",
     "n": 1
    },
    {
     "gold": "high",
     "agent": "high",
     "n": 2
    },
    {
     "gold": "high",
     "agent": "medium",
     "n": 1
    },
    {
     "gold": "low",
     "agent": "high",
     "n": 1
    },
    {
     "gold": "low",
     "agent": "medium",
     "n": 2
    }
   ]
  },
  "ndcg_at_G": {
   "value": 0.6496121725544721,
   "reason": null,
   "status": "deferred",
   "k": 14
  },
  "ndcg_at_5": {
   "value": 0.6621903787502408,
   "reason": null,
   "status": "deferred"
  },
  "mrr_critical": {
   "value": 0.5,
   "reason": null,
   "status": "deferred"
  },
  "critical_in_top3": {
   "value": 0,
   "reason": null,
   "status": "deferred",
   "note": "all critical flaws (first 3 by key order when more than 3) matched within ranks 1-3"
  },
  "quote_fabrication_rate": {
   "value": 0.0,
   "reason": null,
   "status": "secondary",
   "n_quotes": 82,
   "failing": []
  },
  "location_validity_rate": {
   "value": 0.926829268292683,
   "reason": null,
   "status": "exploratory",